[
  {
    "case_id": "rag-001",
    "dataset_version": "0.1.0",
    "split": "development",
    "tier": "silver",
    "category": "fact",
    "query": "标准套餐一个月多少钱？",
    "identity": {
      "tenant_id": "tenant-a",
      "user_id": "user-a",
      "roles": [
        "member"
      ],
      "resource_scopes": []
    },
    "expected_document_ids": [
      "doc-billing-current"
    ],
    "forbidden_document_ids": [
      "doc-billing-stale",
      "doc-billing-future"
    ],
    "expected_evidence": [
      {
        "document_id": "doc-billing-current",
        "chunk_id": null,
        "title": "北风演示客服计费政策（现行 v2）",
        "source": "evals/fixtures/corpus/kb-billing-v2.md",
        "version": "v2",
        "effective_at": "2026-01-01T00:00:00Z",
        "page": null,
        "section": "套餐价格",
        "exact_quote": "标准套餐月费为 199 元。"
      }
    ],
    "expected_answer_points": [
      "标准套餐月费 199 元"
    ],
    "forbidden_answer_points": [
      "99 元",
      "249 元"
    ],
    "should_answer": true,
    "should_clarify": false,
    "should_escalate": false,
    "synthetic": true,
    "provenance": {
      "source_snapshot": "corpus-0.1.0",
      "generator": "RAG-004-session/cursor-grok-4.6",
      "prompt_version": "rag-dataset-v1",
      "generated_at": "2026-09-13T12:00:00Z",
      "review_status": "gold"
    },
    "review": {
      "reviewer": "阿明",
      "reviewed_at": "2026-09-13",
      "decision": "ACCEPT_GOLD",
      "notes": "产品负责人确认 24 条 Gold v0.1。"
    },
    "tags": [
      "fact",
      "billing",
      "easy"
    ]
  },
  {
    "case_id": "rag-002",
    "dataset_version": "0.1.0",
    "split": "development",
    "tier": "silver",
    "category": "fact",
    "query": "企业套餐的月费是多少？",
    "identity": {
      "tenant_id": "tenant-a",
      "user_id": "user-a",
      "roles": [
        "member"
      ],
      "resource_scopes": []
    },
    "expected_document_ids": [
      "doc-billing-current"
    ],
    "forbidden_document_ids": [
      "doc-billing-stale"
    ],
    "expected_evidence": [
      {
        "document_id": "doc-billing-current",
        "chunk_id": null,
        "title": "北风演示客服计费政策（现行 v2）",
        "source": "evals/fixtures/corpus/kb-billing-v2.md",
        "version": "v2",
        "effective_at": "2026-01-01T00:00:00Z",
        "page": null,
        "section": "套餐价格",
        "exact_quote": "企业套餐月费为 999 元。"
      }
    ],
    "expected_answer_points": [
      "企业套餐月费 999 元"
    ],
    "forbidden_answer_points": [
      "599 元"
    ],
    "should_answer": true,
    "should_clarify": false,
    "should_escalate": false,
    "synthetic": true,
    "provenance": {
      "source_snapshot": "corpus-0.1.0",
      "generator": "RAG-004-session/cursor-grok-4.6",
      "prompt_version": "rag-dataset-v1",
      "generated_at": "2026-09-13T12:00:00Z",
      "review_status": "unreviewed"
    },
    "review": {
      "reviewer": null,
      "reviewed_at": null,
      "decision": null,
      "notes": null
    },
    "tags": [
      "fact",
      "billing",
      "easy"
    ]
  },
  {
    "case_id": "rag-003",
    "dataset_version": "0.1.0",
    "split": "development",
    "tier": "silver",
    "category": "fact",
    "query": "如果按年付费，能少付几个月？",
    "identity": {
      "tenant_id": "tenant-a",
      "user_id": "user-a",
      "roles": [
        "member"
      ],
      "resource_scopes": []
    },
    "expected_document_ids": [
      "doc-billing-current"
    ],
    "forbidden_document_ids": [],
    "expected_evidence": [
      {
        "document_id": "doc-billing-current",
        "chunk_id": null,
        "title": "北风演示客服计费政策（现行 v2）",
        "source": "evals/fixtures/corpus/kb-billing-v2.md",
        "version": "v2",
        "effective_at": "2026-01-01T00:00:00Z",
        "page": null,
        "section": "套餐价格",
        "exact_quote": "年付可享受相当于 2 个月免费的优惠，即按 10 个月价格支付全年。"
      }
    ],
    "expected_answer_points": [
      "年付按 10 个月价格，相当于 2 个月免费"
    ],
    "forbidden_answer_points": [
      "8.5 折"
    ],
    "should_answer": true,
    "should_clarify": false,
    "should_escalate": false,
    "synthetic": true,
    "provenance": {
      "source_snapshot": "corpus-0.1.0",
      "generator": "RAG-004-session/cursor-grok-4.6",
      "prompt_version": "rag-dataset-v1",
      "generated_at": "2026-09-13T12:00:00Z",
      "review_status": "unreviewed"
    },
    "review": {
      "reviewer": null,
      "reviewed_at": null,
      "decision": null,
      "notes": null
    },
    "tags": [
      "fact",
      "billing"
    ]
  },
  {
    "case_id": "rag-004",
    "dataset_version": "0.1.0",
    "split": "validation",
    "tier": "silver",
    "category": "fact",
    "query": "对公转账后多久能拿到专票？",
    "identity": {
      "tenant_id": "tenant-a",
      "user_id": "user-a",
      "roles": [
        "member"
      ],
      "resource_scopes": []
    },
    "expected_document_ids": [
      "doc-billing-current"
    ],
    "forbidden_document_ids": [],
    "expected_evidence": [
      {
        "document_id": "doc-billing-current",
        "chunk_id": null,
        "title": "北风演示客服计费政策（现行 v2）",
        "source": "evals/fixtures/corpus/kb-billing-v2.md",
        "version": "v2",
        "effective_at": "2026-01-01T00:00:00Z",
        "page": null,
        "section": "发票",
        "exact_quote": "对公转账到账后，财务应在 5 个工作日内开具增值税专用发票。"
      }
    ],
    "expected_answer_points": [
      "到账后 5 个工作日内开具增值税专用发票"
    ],
    "forbidden_answer_points": [],
    "should_answer": true,
    "should_clarify": false,
    "should_escalate": false,
    "synthetic": true,
    "provenance": {
      "source_snapshot": "corpus-0.1.0",
      "generator": "RAG-004-session/cursor-grok-4.6",
      "prompt_version": "rag-dataset-v1",
      "generated_at": "2026-09-13T12:00:00Z",
      "review_status": "gold"
    },
    "review": {
      "reviewer": "阿明",
      "reviewed_at": "2026-09-13",
      "decision": "ACCEPT_GOLD",
      "notes": "产品负责人确认 24 条 Gold v0.1。"
    },
    "tags": [
      "fact",
      "invoice"
    ]
  },
  {
    "case_id": "rag-005",
    "dataset_version": "0.1.0",
    "split": "development",
    "tier": "silver",
    "category": "fact",
    "query": "新订阅几天内可以申请全额退款？",
    "identity": {
      "tenant_id": "tenant-a",
      "user_id": "user-a",
      "roles": [
        "member"
      ],
      "resource_scopes": []
    },
    "expected_document_ids": [
      "doc-refund-current"
    ],
    "forbidden_document_ids": [],
    "expected_evidence": [
      {
        "document_id": "doc-refund-current",
        "chunk_id": null,
        "title": "北风演示退款政策",
        "source": "evals/fixtures/corpus/kb-refund.md",
        "version": "v1",
        "effective_at": "2026-01-01T00:00:00Z",
        "page": null,
        "section": "全额退款",
        "exact_quote": "订阅后 7 个自然日内可申请全额退款，前提是用量未超过 100 条消息。"
      }
    ],
    "expected_answer_points": [
      "7 个自然日内可申请全额退款",
      "用量未超过 100 条"
    ],
    "forbidden_answer_points": [],
    "should_answer": true,
    "should_clarify": false,
    "should_escalate": false,
    "synthetic": true,
    "provenance": {
      "source_snapshot": "corpus-0.1.0",
      "generator": "RAG-004-session/cursor-grok-4.6",
      "prompt_version": "rag-dataset-v1",
      "generated_at": "2026-09-13T12:00:00Z",
      "review_status": "gold"
    },
    "review": {
      "reviewer": "阿明",
      "reviewed_at": "2026-09-13",
      "decision": "ACCEPT_GOLD",
      "notes": "产品负责人确认 24 条 Gold v0.1。"
    },
    "tags": [
      "fact",
      "refund"
    ]
  },
  {
    "case_id": "rag-006",
    "dataset_version": "0.1.0",
    "split": "development",
    "tier": "silver",
    "category": "fact",
    "query": "在线客服几点上班？",
    "identity": {
      "tenant_id": "tenant-a",
      "user_id": "user-a",
      "roles": [
        "member"
      ],
      "resource_scopes": []
    },
    "expected_document_ids": [
      "doc-hours-current"
    ],
    "forbidden_document_ids": [],
    "expected_evidence": [
      {
        "document_id": "doc-hours-current",
        "chunk_id": null,
        "title": "北风演示客服工作时间",
        "source": "evals/fixtures/corpus/kb-hours.md",
        "version": "v1",
        "effective_at": "2026-01-01T00:00:00Z",
        "page": null,
        "section": "在线客服",
        "exact_quote": "在线客服工作时间为北京时间工作日 09:00-18:00。"
      }
    ],
    "expected_answer_points": [
      "工作日北京时间 09:00-18:00"
    ],
    "forbidden_answer_points": [],
    "should_answer": true,
    "should_clarify": false,
    "should_escalate": false,
    "synthetic": true,
    "provenance": {
      "source_snapshot": "corpus-0.1.0",
      "generator": "RAG-004-session/cursor-grok-4.6",
      "prompt_version": "rag-dataset-v1",
      "generated_at": "2026-09-13T12:00:00Z",
      "review_status": "unreviewed"
    },
    "review": {
      "reviewer": null,
      "reviewed_at": null,
      "decision": null,
      "notes": null
    },
    "tags": [
      "fact",
      "hours"
    ]
  },
  {
    "case_id": "rag-007",
    "dataset_version": "0.1.0",
    "split": "development",
    "tier": "silver",
    "category": "fact",
    "query": "密码连续输错几次会被锁？锁多久？",
    "identity": {
      "tenant_id": "tenant-a",
      "user_id": "user-a",
      "roles": [
        "member"
      ],
      "resource_scopes": []
    },
    "expected_document_ids": [
      "doc-faq-current"
    ],
    "forbidden_document_ids": [],
    "expected_evidence": [
      {
        "document_id": "doc-faq-current",
        "chunk_id": null,
        "title": "北风演示常见问题",
        "source": "evals/fixtures/corpus/kb-faq.md",
        "version": "v1",
        "effective_at": "2026-01-01T00:00:00Z",
        "page": null,
        "section": "账号",
        "exact_quote": "用户可在登录页自助重置密码。连续失败 5 次后，账号锁定 30 分钟。"
      }
    ],
    "expected_answer_points": [
      "连续失败 5 次",
      "锁定 30 分钟"
    ],
    "forbidden_answer_points": [],
    "should_answer": true,
    "should_clarify": false,
    "should_escalate": false,
    "synthetic": true,
    "provenance": {
      "source_snapshot": "corpus-0.1.0",